title,date,content,verified_product,rating
Chronos,Reviewed in India on 13 February 2021,"It’s such a disappointment. I have been using iPhone since it’s first version.

So naturally upgraded from iPhone X to 12. But the excitement quickly died down as soon as I saw the screen. There is a warm greenish tint to it which makes the colors off.

Selfie portraits aren’t good either. Too sharp for portraits. May be I should have gone for the 12 Pro Max as it handles much better because of the telephoto lens.

Hope apple fixes the screen issues soon",Verified Purchase,3
Naval Kumar,Reviewed in India on 9 May 2021,"Phone is good and it fits really well in hand. Only problem I have found in iPhone 12 is overheating and this started from the moment I have unboxed it. I have tried to contact Apple and Amazon but no one is agree to help me fix this heating issue or replace it.

freezing to death all within 6 months and best part there is no after sales support either by Apple or Amazon.

Kind of service I have received from Apple, I think this is my first and last iPhone, second apple product and last.

It's better to get it from other platform or get it from store, Amazon does not provide any after sales support for iPhone 12.

Overall horrible service from giants organization like, Apple and Amazon.",Verified Purchase,1
Dhruv,Reviewed in India on 15 March 2022,"While the iPhone 11 is an amazing device, without doubt, yet it has an IPS display. Older iPhone X and iPhone XS had OLED displays. Apple returned to OLED again with iPhone 12, although the refresh rate is at 60Hz. For those, who have not used devices with 90Hz or 120Hz, you would not notice any differences. Moving from an older iPhone with IPS display to iPhone 12, and you would immediately notice the crisp blacks. Battery size physically is less than the iPhone 11, yet Apple tweaks the A14 Bionic coupled with the iOS, which easily stretches the charge for 10-12hrs. on regular usage. Those heavily into web browsing, gaming etc. may not have such a long run with a single charge, yet it is capable enough for a pretty long day, without the need to plug in to the outlet. Oh, and yes, iPhone 12 comes with a USB-C to Lightning cable, but no charger. You will need to get a USB-C charger separately, either from Apple or other brands. Else, you can use your Qi charger, if you have one already.
iPhone 12 also has a more boxy look, a throwback to the iconic iPhone 4 days. Overall, as with any Apple phone, it is an amazing device, if you use your smartphone for all the regular usage like apps, gaming, web browsing. And yes, it can send messages. Oh, forgot, it can make and receive calls too, quite well!",Verified Purchase,5
Raza V.,Reviewed in India on 18 February 2022,What kind of greedy scumbags don't even include a charger in their phone? Separately buying it costs 2K extra,Verified Purchase,1
Ritik,Reviewed in India on 15 February 2022,"I bought this phone just for creating video content.
My main intention to buy this was it's mind-blowing camera.
But guess what, when the phone got delivered the only thing not working was it's camera.
Now,neither Amazon and not the so called APPLE is replacing the phone even after agreeing that there is a manufacturing defect in the phone.
They just repaired this defective phone .
Really upset with Amazon and APPLE service providers.
Will never buy or recommend anyone else to buy APPLE's product from now on..
#Unsatisfiedcustomer",Verified Purchase,1
JOBIN JOY,Reviewed in India on 3 February 2022,"Play Video
 Battery backup is worst. My 2 year old redmi note7 pro (12k) easily runs one full day with more than 4 hour screen on time. But this new 60k phone almost dies with 2 hour Amazon music. Clearly not worth it. Apart from the 12mp ultra wide camera nothing else is impressive in this comparing to my old phone
. Updated to the latest iOS version. Running in low power mode. Still battery is draining. Since the replacement period is over, totally devastated. To conclude never buy an iPhone ever again. In video Battery charged to 96%. But after restarting the phone it shows 100%.",Verified Purchase,1
Benjamin,Reviewed in India on 2 August 2021,The product was delivered before the expected date of delivery…. Review will be coming up after few weeks usage and the color is quiet vibrant.,Verified Purchase,4
mangalik maity,Reviewed in India on 15 May 2021,Worst battery. It does not even go for 1 whole day with minimum usage. On idle mode battery will drain out in 1.5 days.,Verified Purchase,1
Raj,Reviewed in India on 15 January 2021,"This phone is little bit expensive and the baddest thing there is no charging adapter on box, apple charging this much money for this phone without giving important accessories like charging adapter, 😡",Verified Purchase,3
tarun chitkara,Reviewed in India on 20 May 2021,"Upgraded to brand new iPhone 12 (128gb) last week and from very first moment could feel the phone getting warmer to hotter from rear side and heat travels from back to side bezels making it even unable to hold the phone during FaceTime or work calls. After calling thrice to Apple official support, the staff was disconcerted and blamed it upon ‘normal behaviour’ of phone. However Amazon was kind enough to understand the issue and provided support to me. I recommend Amazon customer service.",Verified Purchase,1
Rashmi,Reviewed in India on 19 November 2020,Do not buy.. there is colour chipping issue around camera. And it is not happening with me only.. so many complaints are there for this but apple is not bothered about it. They are not replacing product (its only 8 month I am using it) such cheap quality was not expected from apple. Disappointed!!!!,Verified Purchase,4
Riddhi,Reviewed in India on 3 August 2021,"The product was getting overheated too soon while using apple apps like iMovie.
Also got heated while charging
If I have to buy an 80k phone and just make calls and messages... doesn't make sense..
And Amazon would not replace it just like that they need a letter from Apple stating ""Service Denial"" so shuttling between Amazon and Apple after 2 days of purchase.",Verified Purchase,1
Vineet,Reviewed in India on 10 February 2022,"I was an Android user and had high hopes with this Apple gadget, however after 8 months of using this so hyped Apple device, I can finally say that an iPhone is similar to a Shadi ka ladoo — jo Khaaye wo pachtaaye aur jo na khaye wo bhi pachtaaye. The reason I am saying this is because this phone lacks even the most basic features that even a 5k android phone has, like - call recording - which I eventually realised that it should have been an Apple feature instead of third party apps - which demand money and are pretty inconvenient to use.

The second drawback is that call logs are auto erased and kept up to a certain stack size (100 / 102) and if you want to go back to pull any earlier call logs beyond this specified stack size, you won’t be able to do so and will have to rely on your network provider (if you are eligible) for the same.

These are two very ground level use cases that fail to deliver in an Apple device and since I faced real life situations surrounding these two scenarios I feel that I it is not worth having this Phone and better to keep your “Android” pants on.

Then I thought why I bought this phone in the first place and got my answer -

1. Camera ??
Android phones are easily competing nicely with iPhone Camera now-a-days and some have even better camera.

2. Brand marketing / re-selling value / durability ??
I am so over it now after 8 months of usage and the price keeps on sinking down as newer model enters the market so not a wise call I must say

Final outcome:
Definitely not a returning customer.",Verified Purchase,1
Junaid Masoodi,Reviewed in India on 9 November 2020,"Overall it looks good, coming from XR it looks a good upgrade for me. Design is ‘back to basics’ which is compelling. I loved the fast response among other things.",Verified Purchase,5
Lav,Reviewed in India on 30 December 2020,"I used to use an Android phone till 2014 and wanted to switch to iOS, so the same year I bought iPhone 6, It was good to have an iOS device and the performance and the cameras but those were sufficient only until next year when 6s launched. Though I was a fan of the iPhone 5 and 5s box design but couldn't buy them somehow. I wasn't and I'm not crazy about changing or upgrading phone every year so in 2015 I bought again iPhone 6s by having a thought that this phone has everything which I needed ever, except for box design. Now I was satisfied enough with this.
As time goes on and years passed away many iPhone models came but I wasn't eager to buy any of them but when this year series 12 launched, that made me excited to buy because firstly I was technologically behind and secondly the nostalgic box design.
Years ago, when I switched to iOS, I'm quite satisfied with it, I never thought and want to go back to Android.
When it comes to iPhone 12, it's a great and beautiful device. Smooth performance, good battery life, overpriced of course but people always have the choice to buy it or not. Though face ID is new to me and initially little inconvenient compared to touch ID, hopefully, I'm gonna used to of it.
I bought a 128 GB device as per my requirement and colour white because finger prints on back are not visible, compared to other darker colours.
INR 3000₹ Discount on the colour white, plus 6000₹ HDFC instant discount. Effective price 76000₹. Unfortunately Charging Brick isn't included and it coasted 1900₹ more for 20W USB-C from Apple India website.
Overall it's a great device and satisfied purchase but overpriced for sure.",Verified Purchase,4
Ayushi Abhipsa,Reviewed in India on 7 July 2021,"Guys let me tell you, I was a huge fan of androids and I literally never thought of buying an iphone, but then thought of giving it a try🥺🥺🥺and you couldn’t believe how much i mean to what extent i like this phone. This is a perfect phone ever with awesome battery life (I use it very much still one and half day chal jata he) speed is mind blowing and camera just wowwww!!! No need of buying fancy iphone 12 pro max this is more than enough yaar😍😍You will never ever regret buying this

Reviewing after a use of 2 months",Verified Purchase,5
Amesh Gharat,Reviewed in India on 25 March 2021,"Overall good phone as it feels very premium, being made with high quality materials and has great performance. Excellent camera quality, great design and screen quality. The A14 processor is super fast and the phone never heats up even while performing intensive tasks. The speakers are very loud and clear and give out high quality sound.
One problem I encountered is that the battery life is not great but definitely above average. Another issue is the notch which makes the phone look outdated especially in 2021. The Face ID is also not useful while wearing masks which causes a lot of inconvenience since the phone doesn’t have a fingerprint scanner. The phone is also limited to a 60Hz refresh rate which again makes it less compelling than the competition which makes phones with 120Hz refresh rate at a much lower price.",Verified Purchase,4
s3r,Reviewed in India on 1 June 2021,"No wonder Apple makes some of the best phones in the world. Iphone 12 deservedly is the highest selling phone.

I was upgrading from iphone 7 which served me well for 4 years, which I exchanged for this.

The delivery & exchange formalities were smooth.

The phone itself is surely an upgrade when compared to 7, the display is top notch, the camera is probably the best there is, the face unlock works like a charm, what's to say about the best phone, it works even better than advertised.

The only problem like always is the battery which hardly lasts a day & charging time is also an issue, it tends to heat up a little while charging but with the previous experience with iphone 7, the longevity of the phone is guaranteed with the timely updates from Apple, the premium which an iphone demands stands justified with a superior product.

Some people tried to discourage me from buying an iphone from Amazon claiming warranty & support issues. But there's no substance to such things. I confirmed the warranty & product registration from Apple, it's as advertised.

Since most of us are going to use it for a longer period of time, it's prudent to opt for the extended warranty offered by Apple which costs around 16500 which gives us an extended year of warranty. Do remember to do this within 3 months of your purchase.",Verified Purchase,4
Raghuvaran N,Reviewed in India on 27 January 2022,The phone already had a profile when I opened the settings. This is a refurbished phone. I logged in with my apple ID only to find another person has already been using this phone. This is clearly a refurbished item being sold as new. Please stop this cheating and refund my purchase.,Verified Purchase,1
Jamadagni,Reviewed in India on 22 February 2021,"Upgraded from an iPhone 7 32 gigs to iPhone 12 . After holding out for a long time the upgrade was worth it. All the feature set display, camera, speakers, signal reception, chipset is a huge upgrade. Recommended if you happen to have a device from 2016 or older. This device will be the new standard iPhone for the next 4 years. So worth it if you get it now.",Verified Purchase,5
Brijesh Pandey,Reviewed in India on 16 January 2021," Phone is awesome no doubt camera also as expected Smooth phone
But There is no adaptor charger iphone provide only data cable people spend 85k and then again spend for 2k for charger that is very inappropriate this is not good people will not buy if this will continue providing not charger. What’s the meaning of phone people buy phone and don’t have charger to charge the phone first experience is mine for iphone is very bad because of charger. Because new c type adaptor is not getting everywhere how people will charge his phone. 85000 is a big amount so thing about it and provide full sets of charger.",Verified Purchase,4
Ashwin Menon,Reviewed in India on 29 July 2021,,Verified Purchase,5
akash kumar,Reviewed in India on 19 June 2021,"Now it's almost more than 2 weeks of usage and I'm fully satisfied with the performance. Earlier I was using oneplus 6T and after malfunction of the screen, i decided to move to Iphone. Before buying i had done all the R&D. Many of reviews says that it has bad battery life and couldn't stand a day. But as per my usages my battery stays all day long. I used to make call (6 to 7 hours), video, music, surfing everything except game and battery last upto 24 hours with data mode on.
In my opinion its worth buying.",Verified Purchase,5
Supriya,Reviewed in India on 21 January 2022," I was litterly worried before getting it delivered, as my delivery was late, I thought they will be some golmal on product, but I got the original product which I was expecting.. pls go n buy, don't get panic by seeing reviews.. I'm very excited with my new phone.. battery life is also good. Face is awesomepart and camera quality at picks... best deal for this independence day 😍🤩",Verified Purchase,5
Preksha,Reviewed in India on 27 January 2021,The product found faulty after one week The microphone of speaker was not working in the phone. It Was in warranty period so got replaced by new one.,Verified Purchase,1
Shibu,Reviewed in India on 4 August 2021,"I was an android user before using iPhone. So that this is my first experience handling with iOS.
As an android user I felt little bit difficult while using iOS but later you would love it.
Performance of this phone is awesome and outstanding. Photo and video quality, sound quality, connectivity etc all is good.
I experienced the heating issue while charging and phone calls. But the coolant system is good, it will cool down quickly.
Overall it’s a good phone.",Verified Purchase,4
Jal,Reviewed in India on 16 December 2021,"After spending 60k on Amazon Rcvd Defected piece , sealed was opened & there was lots of scratches on IPhone, not expected this from amazon.",Verified Purchase,1
Vignesh Bhasker,Reviewed in India on 1 June 2021,"I have been an apple user for the past 10 years and this is the first phone which is disappointing. I was using the Xr and 11 before this and though of upgrading.

1. If you are moving from an android to iPhone for the 1st time, its a great phone to get in terms of camera, processor, screen quality. But if you are already an existing iPhone user, upgrade only from XR downwards. That is if your are upgrading from a 8/X/XS/XR. If you have a 11, stick to it. Wait for the 13 or budget is not a constraint then get the 12 pro.

2. form factor. Apple has gone back to rectangle brick design that they used in their earlier phones. Now for me this was one the reasons I didn't like the phone. It wasn't comfortable n the hand after being used to the curve of the X and 11 and XR

3. Camera- best camera quality with night mode . u can't go wrong with this camera setup.

4. screen- excellent screen quality , no complaints here.

5. 5g - IS it really that big a deal breaker ? especially if you are in India where 5g seems a long way off.

6. No charging adapter. You either have to connect it to your MacBook or buy a separate power adapter. When ur spending 70 odd grand, that's the least apple could offer.

7. again no ear phones.

8. It somehow doesn't have the wow factor as what the X had.

Update.

I exchange my phone for a 12 mini. much more easier to use with one hand and comfortable.",Verified Purchase,3
Bhavkan Indane,Reviewed in India on 26 March 2021,Product was switched off permanently after a week.,Verified Purchase,1
Rahul,Reviewed in India on 15 January 2022,"Cons:

1.Overpriced phone( which should be around 45k)
2.No Adapter
3.Ugly Layout at the side of screen.( Iphone xs max which i have has better layout)
4.No Telephoto lense at this price seriously a joke",Verified Purchase,4
Ramesh Chand Verma,Reviewed in India on 3 April 2021,"facing less life problem in battery, need to replace it
very poor service, pick up scheduled today 09.04.2021, however delivery boy not picked up the phone inspite of coming at our company, very poor service from amazon, we are very disappointed",Verified Purchase,2
Saptarshi Dutt,Reviewed in India on 3 April 2021,"Excellent phone, only reason I have reduced one star is since Amazon reduced the price by Rs 3000 the day after I received the phone and this really hurts after spending so much of my hard earned money. Exchange value received for my older phone was also pretty inadequate, considering the condition it was in.

Pros:
1. The green colour is gorgeous
2. Cameras are outstanding
3. Battery life is really good, lasts me almost 2 days on a charge
4. Screen is very bright and has vibrant colours
5. Speaker is very loud

Cons:
1. Just nitpicking, but a fingerprint sensor would have been much more convenient during Covid
2. Indian variant doesn't have the mmWave antenna, inspite of being more expensive than the US Variant

Overall, a great buy.

TIP: Please do not buy 64 GB model, unless you have a robust cloud subscription to upload stuff into.",Verified Purchase,4
Pushkar Dighe,Reviewed in India on 18 January 2022,Overall mobile is good but found blue spots on side and upper frame. This is not expected from Amazon. This is my worst order experience with Amazon. Really disappointing!,Verified Purchase,1
Nitesh T.,Reviewed in India on 18 January 2022, This is my first iPhone and the phone is really awesome as i have seen in lots of reviews. I am already aware with iOS since i have iPad. I have pocof1 which i bought in 2018 and after spending 3 years with Android i made up my mind to move to iOS. The packaging was well and I recieved the phone in 1 day.,Verified Purchase,5
MANU GOPINATH,Reviewed in India on 24 January 2021,"Completely satisfied with the performance , Camera and Battery life. But display totally disappointed me. There is an extra yellow tint for the display and colors are off. I am a photographer and colour grading artist. So accurate color reproduction is of almost importance to me. Please reconsider your decision if you are in similar profession",Verified Purchase,4
...who else,Reviewed in India on 2 April 2021,"Yes, it is a 5 star phone. But if you are moving from android to iPhone please be ready to lose your freedom. There is a lot available on internet to tell you about what you will lose out on. It is like speaking a new language altogether.
Quick image editing, video editing, simple things like making collages, setting custom ringtones, quick editing of alarms, changing WiFi or Bluetooth, toggling location, many more basic features are either absent in iOS or managed in a very cumbersome way. You will miss them if moving from Andriod. Also be ready to lose your WhatsApp chat history. Not impressed by the sound reproduction on bigger speakers via Bluetooth and the very inflexible equilizer.
For some silly reasons Apple is being stubborn on some aspects like standardisation of charging cable even within its own products. The notch at the top of the screen is still the same size it was in 2018.
Rest, there are tons of reviews to praise the phone and I agree with most of them.

Was a bit disappointed the way it was packaged. No foam or bubble wrap.",Verified Purchase,4
NQ1194,Reviewed in India on 31 January 2021,"Upgraded from one plus 7 pro
Never used IOS before,
Must say this is what phones are supposed to be.
Just go for it.
Early delivery by Amazon , Well packed and secure package.",Verified Purchase,5
Anjana.D,Reviewed in India on 30 July 2021,"I have been using iPhone 12 from past 20days. Overall a great phone with best battery life, best camera and great display. The most important thing about this phone is the performance. It’s top notch. A14 Bionic chip which is 5mm SOC with 5G modem delivers a greater performance without any lag. With few latest iOS updates(14.7.1) and few changes in configuration/settings I get a battery life for 2 days per charge(96%). Overall a beast in all segments including the price.

For the price apple should have provided a charging brick and earphones, but they have not. Currently Amazon is selling this phone for 73k which is the best deal. Go for it.",Verified Purchase,5
Siddharth Shankar,Reviewed in India on 29 January 2022," Lack of innovation, I also i didn't like software as I struggle to go back from any screen I open.

Android is much easier and user friendly.",Verified Purchase,5
Sunny Uppatla,Reviewed in India on 22 December 2020,What i am feeling is there is some difference buying products on amazon and stores directly. I have compared with my friends battery life has huge change she gets a day and mine ends within 7-8 hours,Verified Purchase,4
aman choudhary,Reviewed in India on 15 February 2022,"Buy it if you really worried about environment and carbon emissions, apple is taking care of it by not providing adaptor, you will still buy it @ 2K but that adaptor work on biogas, very eco-friendly, it sucks
Overall good buy, it help you keep High status in the society, really good device to use also, you should buy it on discount and in collaboration with your family and partner. There is a screen in the front with apple logo at the back, A top notch bazzle visible from miles, battery might not run for a day, but people do still admire the dead iphone which is great thing to be part of, other than this sound quality is better, camera awesome, full pack of connectivity issues, you will be able to know how capable you are to find the solutions.",Verified Purchase,4
Ubaid Rather,Reviewed in India on 4 October 2021,"If you face any issues with the product and want to return within the 7 days of your purchase, you can’t.
In 7days return policy, it is mentioned to raise concern with Apple.

Just putting this out there for the people who doesn’t read all terms and conditions like me.",Verified Purchase,1
Suhail Khan,Reviewed in India on 7 March 2022,"It’s my first iPhone ever and I bought it with my earned money through part time jobs in college✌️

I am a tech freak so you can trust my views -
- A14 Bionic is the fastest, most efficient and reliable processor till date
- The camera focuses so quickly that you can take DSLR quality photos.
- The screen size 6.1 inches is the most comfortable screen size out there and the OLED retina XDR display is so crisp and everything feels real.
- The stereo speakers are so clear even on high volume and gives awesome vibe while listening to music
- iOS has no bugs at all
- 20W charging is lit 🔥
- The Face ID feels like having no lock for yourself, there’s no issue while using Face ID even in the dark because it uses infrared rays to scan the face

Drawbacks -
- Battery could be better",Verified Purchase,5
